{
  "schema_version": "1.7",
  "host": {
    "id": "ce99afc90319241965b46e5cef264e280b25e9ad91c7a60a816b3bd058b8bbd0",
    "hostname": "6d9106647d07",
    "platform": "linux",
    "os": "Fedora Linux 40 (Container Image)",
    "kernel": "7.2.12-orbstack-00394-gbecdd6130068",
    "transport": "fixture",
    "remote_shell": "/bin/bash",
    "canary": "n/a",
    "elevation": "sudo"
  },
  "run": {
    "started": "2026-09-20T12:00:00Z",
    "duration_ms": 1234,
    "status": "complete",
    "profile": "baseline",
    "assessment": "rules",
    "mode": "facts",
    "provider": null,
    "model": null,
    "effort": null,
    "native": null,
    "limits": null,
    "usage": {
      "input": 0,
      "output": 0,
      "cache_read": 0,
      "cache_write": 0,
      "cost_usd": null
    },
    "context_sources": [],
    "persisted": null,
    "warnings": [],
    "scheck_version": "test"
  },
  "assessments": [
    {
      "observation": "accounts.passwd_status#1",
      "finding": "accounts.empty_password",
      "check": "accounts.passwd_status",
      "with": "accounts.passwd",
      "with_observation": "accounts.passwd#1",
      "status": "not_matched",
      "reason": "no-matching-record"
    },
    {
      "observation": "accounts.shadow_meta#1",
      "finding": "accounts.shadow_permissions_unexpected",
      "check": "accounts.shadow_meta",
      "status": "not_matched",
      "reason": "recognized-expected-value"
    },
    {
      "observation": "creds.home_files#1",
      "finding": "creds.cloud_credentials_exposed",
      "check": "creds.home_files",
      "status": "not_assessed",
      "reason": "no-file-listed"
    },
    {
      "finding": "creds.env_file_exposed",
      "check": "creds.app_env_1",
      "status": "not_assessed",
      "reason": "check-not-run"
    },
    {
      "finding": "creds.env_file_exposed",
      "check": "creds.app_env_2",
      "status": "not_assessed",
      "reason": "check-not-run"
    },
    {
      "finding": "creds.env_file_exposed",
      "check": "creds.app_env_3",
      "status": "not_assessed",
      "reason": "check-not-run"
    },
    {
      "finding": "creds.env_file_exposed",
      "check": "creds.app_env_4",
      "status": "not_assessed",
      "reason": "check-not-run"
    },
    {
      "finding": "creds.env_file_exposed",
      "check": "creds.app_env_5",
      "status": "not_assessed",
      "reason": "check-not-run"
    },
    {
      "observation": "creds.home_files#1",
      "finding": "creds.ssh_key_exposed",
      "check": "creds.home_files",
      "status": "not_assessed",
      "reason": "no-file-listed"
    },
    {
      "observation": "docker.sockets#1",
      "finding": "docker.socket_exposed",
      "check": "docker.sockets",
      "status": "not_assessed",
      "reason": "no-file-listed"
    },
    {
      "observation": "fs.world_writable#1",
      "finding": "fs.world_writable_present",
      "check": "fs.world_writable",
      "status": "not_matched",
      "reason": "no-matching-line"
    },
    {
      "observation": "log.auditd#1",
      "finding": "log.auditd_inactive",
      "check": "log.auditd",
      "status": "not_assessed",
      "reason": "check-unavailable:exit_error"
    },
    {
      "observation": "mac.sestatus#1",
      "finding": "mac.selinux_disabled",
      "check": "mac.sestatus",
      "status": "not_assessed",
      "reason": "check-unavailable:command_missing"
    },
    {
      "observation": "sshd.config#1",
      "finding": "sshd.password_auth_enabled",
      "check": "sshd.config",
      "status": "not_matched",
      "reason": "recognized-other-value"
    },
    {
      "observation": "sshd.config#1",
      "finding": "sshd.root_login_enabled",
      "check": "sshd.config",
      "status": "not_matched",
      "reason": "recognized-other-value"
    },
    {
      "observation": "time.timedatectl#1",
      "finding": "time.ntp_unsynced",
      "check": "time.timedatectl",
      "status": "not_assessed",
      "reason": "check-unavailable:exit_error"
    },
    {
      "observation": "pkg.apt_upgradable#1",
      "finding": "updates.pending",
      "check": "pkg.apt_upgradable",
      "status": "not_assessed",
      "reason": "check-unavailable:command_missing"
    },
    {
      "observation": "pkg.dnf_check_update#1",
      "finding": "updates.pending",
      "check": "pkg.dnf_check_update",
      "status": "matched",
      "reason": "records-present"
    },
    {
      "observation": "pkg.zypper_lp#1",
      "finding": "updates.pending",
      "check": "pkg.zypper_lp",
      "status": "not_assessed",
      "reason": "check-unavailable:command_missing"
    }
  ],
  "findings": [
    {
      "id": "updates.pending",
      "title": "Software updates are pending",
      "category": "updates",
      "severity_base": "low",
      "severity": "low",
      "adjustments": [],
      "status": "open",
      "source": "rule",
      "confidence": "high",
      "platform": "linux",
      "evidence": [
        {
          "observation": "pkg.dnf_check_update#1",
          "check": "pkg.dnf_check_update",
          "excerpt": "name=audit-libs.aarch64 version=4.0.3-1.fc40 (+36 more)"
        }
      ],
      "impact": "Published fixes, including security fixes, are available but not installed. How serious that is depends on which packages are behind.",
      "remediation": {
        "summary": "Review the pending updates and apply them with the host's package manager.",
        "commands": [
          "# review the list first, then apply with apt / dnf / zypper / softwareupdate"
        ],
        "caveat": "Some updates need a restart to take effect; schedule accordingly."
      }
    }
  ],
  "facts": {
    "accounts.passwd": {
      "observation": "accounts.passwd#1",
      "status": "ok",
      "attempted": true,
      "summary": "22 accounts, 2 with a login shell",
      "parsed": {
        "kind": "accounts",
        "items": [
          {
            "home": "/root",
            "name": "root",
            "shell": "/bin/bash",
            "uid": "0"
          },
          {
            "home": "/bin",
            "name": "bin",
            "shell": "/usr/sbin/nologin",
            "uid": "1"
          },
          {
            "home": "/sbin",
            "name": "daemon",
            "shell": "/usr/sbin/nologin",
            "uid": "2"
          },
          {
            "home": "/var/adm",
            "name": "adm",
            "shell": "/usr/sbin/nologin",
            "uid": "3"
          },
          {
            "home": "/var/spool/lpd",
            "name": "lp",
            "shell": "/usr/sbin/nologin",
            "uid": "4"
          },
          {
            "home": "/sbin",
            "name": "sync",
            "shell": "/bin/sync",
            "uid": "5"
          },
          {
            "home": "/sbin",
            "name": "shutdown",
            "shell": "/sbin/shutdown",
            "uid": "6"
          },
          {
            "home": "/sbin",
            "name": "halt",
            "shell": "/sbin/halt",
            "uid": "7"
          },
          {
            "home": "/var/spool/mail",
            "name": "mail",
            "shell": "/usr/sbin/nologin",
            "uid": "8"
          },
          {
            "home": "/root",
            "name": "operator",
            "shell": "/usr/sbin/nologin",
            "uid": "11"
          },
          {
            "home": "/usr/games",
            "name": "games",
            "shell": "/usr/sbin/nologin",
            "uid": "12"
          },
          {
            "home": "/var/ftp",
            "name": "ftp",
            "shell": "/usr/sbin/nologin",
            "uid": "14"
          },
          {
            "home": "/",
            "name": "nobody",
            "shell": "/usr/sbin/nologin",
            "uid": "65534"
          },
          {
            "home": "/",
            "name": "tss",
            "shell": "/usr/sbin/nologin",
            "uid": "59"
          },
          {
            "home": "/",
            "name": "dbus",
            "shell": "/sbin/nologin",
            "uid": "81"
          },
          {
            "home": "/",
            "name": "systemd-network",
            "shell": "/usr/sbin/nologin",
            "uid": "192"
          },
          {
            "home": "/",
            "name": "systemd-oom",
            "shell": "/usr/sbin/nologin",
            "uid": "999"
          },
          {
            "home": "/",
            "name": "systemd-resolve",
            "shell": "/usr/sbin/nologin",
            "uid": "193"
          },
          {
            "home": "/usr/share/empty.sshd",
            "name": "sshd",
            "shell": "/usr/sbin/nologin",
            "uid": "74"
          },
          {
            "home": "/",
            "name": "systemd-coredump",
            "shell": "/usr/sbin/nologin",
            "uid": "998"
          },
          {
            "home": "/",
            "name": "systemd-timesync",
            "shell": "/usr/sbin/nologin",
            "uid": "997"
          },
          {
            "home": "/home/ops",
            "name": "ops",
            "shell": "/bin/bash",
            "uid": "1000"
          }
        ],
        "partial": false
      },
      "duration_ms": 0
    },
    "accounts.passwd_status": {
      "observation": "accounts.passwd_status#1",
      "status": "ok",
      "attempted": true,
      "summary": "22 accounts, all locked",
      "parsed": {
        "kind": "passwd_status",
        "items": [
          {
            "name": "root",
            "status": "L"
          },
          {
            "name": "bin",
            "status": "L"
          },
          {
            "name": "daemon",
            "status": "L"
          },
          {
            "name": "adm",
            "status": "L"
          },
          {
            "name": "lp",
            "status": "L"
          },
          {
            "name": "sync",
            "status": "L"